{
  "schema_version": "0.2.0",
  "dataset_type": "multiphase_flow_simulation",
  "global": {
    "dataset_id": "owner/dataset-name",
    "title": "Dataset title",
    "version": "1.0.0",
    "description": "One paragraph summary of the multiphase-flow simulation dataset.",
    "contributors": [
      {
        "name": "Contributor Name",
        "affiliation": "Institution",
        "orcid": "",
        "email": ""
      }
    ],
    "license": {
      "data": "CC BY 4.0",
      "code": "MIT",
      "notes": ""
    },
    "citation": {
      "doi": "",
      "preferred_citation": "",
      "related_papers": []
    },
    "access": {
      "landing_page": "",
      "download_url": "",
      "repository_url": "",
      "checksums_file": "checksums.sha256"
    },
    "physics": {
      "flow_type": "two_phase_flow",
      "configuration": "droplet/bubble/spray/film/channel/periodic_box/etc.",
      "governing_equations": "incompressible two-phase Navier-Stokes with surface tension",
      "phase_indicator_convention": "alpha=1 liquid, alpha=0 gas",
      "phases": [
        {
          "name": "liquid",
          "role": "dispersed_or_continuous"
        },
        {
          "name": "gas",
          "role": "dispersed_or_continuous"
        }
      ],
      "physical_parameters": {
        "density": {
          "liquid": { "value": null, "units": "kg m-3" },
          "gas": { "value": null, "units": "kg m-3" }
        },
        "dynamic_viscosity": {
          "liquid": { "value": null, "units": "Pa s" },
          "gas": { "value": null, "units": "Pa s" }
        },
        "surface_tension": { "value": null, "units": "N m-1" },
        "gravity": { "value": [0.0, 0.0, 0.0], "units": "m s-2" },
        "contact_angle": { "value": null, "units": "degree" }
      },
      "dimensionless_numbers": {
        "Re": null,
        "We": null,
        "Ca": null,
        "Fr": null,
        "Bo": null,
        "Oh": null,
        "At": null
      },
      "boundary_conditions": "Describe all boundaries.",
      "initial_conditions": "Describe initial interface and velocity fields."
    },
    "numerics": {
      "solver": "NGA2/OpenFOAM/Basilisk/etc.",
      "interface_method": "VOF",
      "spatial_discretization": "",
      "temporal_discretization": "",
      "pressure_velocity_coupling": "",
      "interface_advection": "",
      "surface_tension_model": "",
      "time_step_policy": "",
      "convergence_or_resolution_notes": ""
    },
    "grid": {
      "spatial_dimension": 3,
      "grid_type": "uniform_structured",
      "shape": [256, 256, 256],
      "domain_size": {
        "value": [1.0, 1.0, 1.0],
        "units": "m"
      },
      "coordinate_order": "[i,j,k]",
      "storage_order": "fortran_order",
      "field_location": "cell_centered",
      "coordinates": {
        "x": "grid/x.dat",
        "y": "grid/y.dat",
        "z": "grid/z.dat"
      }
    },
    "required_field_roles": {
      "phase_indicator": "alpha",
      "velocity": ["u", "v", "w"],
      "pressure": "p"
    },
    "variables": [
      {
        "name": "alpha",
        "role": "phase_indicator",
        "standard_name": "volume_fraction",
        "description": "Volume fraction field. Convention: alpha=1 liquid, alpha=0 gas.",
        "units": "1",
        "shape": ["nx", "ny", "nz"],
        "dtype": "float32",
        "location": "cell_centered",
        "valid_range": [0.0, 1.0],
        "required": true
      },
      {
        "name": "u",
        "role": "velocity_component",
        "standard_name": "velocity_x",
        "units": "m s-1",
        "shape": ["nx", "ny", "nz"],
        "dtype": "float32",
        "location": "cell_centered",
        "required": true
      },
      {
        "name": "v",
        "role": "velocity_component",
        "standard_name": "velocity_y",
        "units": "m s-1",
        "shape": ["nx", "ny", "nz"],
        "dtype": "float32",
        "location": "cell_centered",
        "required": true
      },
      {
        "name": "w",
        "role": "velocity_component",
        "standard_name": "velocity_z",
        "units": "m s-1",
        "shape": ["nx", "ny", "nz"],
        "dtype": "float32",
        "location": "cell_centered",
        "required": true
      },
      {
        "name": "p",
        "role": "pressure",
        "standard_name": "pressure",
        "units": "Pa",
        "shape": ["nx", "ny", "nz"],
        "dtype": "float32",
        "location": "cell_centered",
        "required": true
      },
      {
        "name": "kappa",
        "role": "derived_interface_geometry",
        "standard_name": "interface_curvature",
        "description": "Optional derived curvature field when available.",
        "units": "m-1",
        "shape": ["nx", "ny", "nz"],
        "dtype": "float32",
        "location": "cell_centered",
        "required": false
      }
    ],
    "splits": {
      "policy": "case-level split",
      "train_cases": [],
      "validation_cases": [],
      "test_cases": []
    },
    "known_limitations": []
  },
  "local": [
    {
      "id": 0,
      "case_id": "case_0000",
      "snapshot_id": 0,
      "time": {
        "value": 0.0,
        "units": "s"
      },
      "files": {
        "alpha": "data/case_0000/alpha_000000.dat",
        "u": "data/case_0000/u_000000.dat",
        "v": "data/case_0000/v_000000.dat",
        "w": "data/case_0000/w_000000.dat",
        "p": "data/case_0000/p_000000.dat"
      },
      "case_parameters": {
        "Re": null,
        "We": null,
        "notes": ""
      }
    }
  ]
}
